{
  "schema_version": "4.0",
  "case_id": "case001-v2",
  "source_id": "src-authored-order-csv",
  "family_id": "fam-authored-order-csv",
  "case_key": "case001",
  "version": 2,
  "title": "CSV去重与汇总",
  "status": "frozen",
  "source_version": "1",
  "split": "development",
  "usage": "development_only",
  "source_record": "cases/case001/source.json",
  "source_file": "cases/case001/clean/source.md",
  "source_sha256": "089f741805a2230096d8ee2e01154ee381e02f6f7060078a698c642d43760e2a",
  "contract_file": "standards/case001/contract.json",
  "task_files": [
    "standards/case001/tasks/case001-v2.example.json",
    "standards/case001/tasks/case001-v2.offset_0830.json",
    "standards/case001/tasks/case001-v2.large_exact_sum.json",
    "standards/case001/tasks/case001-v2.header_only.json",
    "standards/case001/tasks/case001-v2.empty.json",
    "standards/case001/tasks/case001-v2.wrong_field_count.json",
    "standards/case001/tasks/case001-v2.invalid_discarded_duplicate.json",
    "standards/case001/tasks/case001-v2.invalid_amount_NA.json",
    "standards/case001/tasks/case001-v2.invalid_amount_null.json",
    "standards/case001/tasks/case001-v2.invalid_amount_neg1.json",
    "standards/case001/tasks/case001-v2.invalid_amount_1e2.json"
  ],
  "variant_files": [
    "cases/case001/variants/clean.json"
  ],
  "official": {
    "domain": "data-processing",
    "domain_type": "default",
    "family_name": "CSV去重与汇总"
  }
}
